,Authors,Title,Subtitle,Publisher,Date Published,Description,ISBN-10,ISBN-13,Page Count,Print Type,Genres,Average Rating,Ratings Count,Image Link,Language,Preview Link,Sale Country,Saleability,E-Book,Summary
76,['Ted Chiang'],Exhalation,Stories,Knopf,2019,"ONE OF THE NEW YORK TIMES 10 BEST BOOKS OF THE YEAR A NATIONAL BESTSELLER ""Exhalation by Ted Chiang is a collection of short stories that will make you think, grapple with big questions, and feel more human. The best kind of science fiction."" --Barack Obama From the acclaimed author of Stories of Your Life and Others--the basis for the Academy Award -nominated film Arrival: a groundbreaking new collection of short fiction. ""THE UNIVERSE BEGAN AS AN ENORMOUS BREATH BEING HELD."" In these nine stunningly original, provocative, and poignant stories, Ted Chiang tackles some of humanity's oldest questions along with new quandaries only he could imagine. In ""The Merchant and the Alchemist's Gate,"" a portal through time forces a fabric seller in ancient Baghdad to grapple with past mistakes and second chances. In ""Exhalation,"" an alien scientist makes a shocking discovery with ramifications that are literally universal. In ""Anxiety Is the Dizziness of Freedom,"" the ability to glimpse into alternate universes necessitates a radically new examination of the concepts of choice and free will. Including stories being published for the first time as well as some of his rare and classic uncollected work, Exhalation is Ted Chiang at his best: profound, sympathetic--revelatory.",1101947888,9781101947883,350.0,BOOK,['FICTION'],4.0,28.0,http://books.google.com/books/content?id=vRb9uQEACAAJ&printsec=frontcover&img=1&zoom=5&source=gbs_api,en,http://books.google.ca/books?id=vRb9uQEACAAJ&dq=isbn:9781101947883&hl=&cd=1&source=gbs_api,CA,NOT_FOR_SALE,False,"ONE OF THE NEW YORK TIMES 10 BEST BOOKS OF THE YEAR A NATIONAL BESTSELLER &quot;Exhalation by Ted Chiang is a collection of short stories that will make you think, grapple with big questions, and feel more human."
77,['Seanan McGuire'],Down Among the Sticks and Bones,,Tor.com,2017-06-13,"Seanan McGuire returns to her popular Wayward Children series with Down Among the Sticks and Bones—a truly standalone story suitable for adult and young adult readers of urban fantasy, and the follow-up to the Alex Award-winning, Hugo, Nebula, and Locus finalist, Tiptree Honor List Every Heart a Doorway Twin sisters Jack and Jill were seventeen when they found their way home and were packed off to Eleanor West’s Home for Wayward Children. This is the story of what happened first... Jacqueline was her mother’s perfect daughter—polite and quiet, always dressed as a princess. If her mother was sometimes a little strict, it’s because crafting the perfect daughter takes discipline. Jillian was her father’s perfect daughter—adventurous, thrill-seeking, and a bit of a tom-boy. He really would have preferred a son, but you work with what you've got. They were five when they learned that grown-ups can’t be trusted. They were twelve when they walked down the impossible staircase and discovered that the pretense of love can never be enough to prepare you a life filled with magic in a land filled with mad scientists and death and choices.",9780765392039,9780765392039,192.0,BOOK,['Fiction'],3.5,51.0,http://books.google.com/books/content?id=XgurDgAAQBAJ&printsec=frontcover&img=1&zoom=5&source=gbs_api,en,http://books.google.ca/books?id=XgurDgAAQBAJ&dq=isbn:9780765392039&hl=&cd=1&source=gbs_api,CA,NOT_FOR_SALE,False,A stand-alone dark fantasy tale from the world of Every Heart a Doorway: what happened to Jack and Jill before they tumbled into Eleanor West’s Home for Wayward Children?
78,['Seanan McGuire'],Every Heart a Doorway,,Macmillan,2016-04-05,"Eleanor West's Home for Wayward Children No Solicitations No Visitors No Quests Children have always disappeared under the right conditions; slipping through the shadows under a bed or at the back of a wardrobe, tumbling down rabbit holes and into old wells, and emerging somewhere... else. But magical lands have little need for used-up miracle children. Nancy tumbled once, but now she's back. The things she's experienced... they change a person. The children under Miss West's care understand all too well. And each of them is seeking a way back to their own fantasy world. But Nancy's arrival marks a change at the Home. There's a darkness just around each corner, and when tragedy strikes, it's up to Nancy and her new-found schoolmates to get to the heart of things. No matter the cost. PRAISE FOR EVERY HEART A DOORWAY ""Seanan McGuire has long been one of the smartest writers around, and with this novella we can easily see that her heart is as big as her brain. We know this story isn't true, but it is truth."" — Charlaine Harris, New York Times bestselling author of the Sookie Stackhouse series (TV's True Blood) ""Seanan McGuire once again demonstrates her intimate knowledge of the human heart in a powerful fable of loss, yearning and damaged children."" — Paul Cornell, author of London Falling and Witches of Lychford",9780765385505,9780765385505,176.0,BOOK,['Fiction'],3.5,99.0,http://books.google.com/books/content?id=9epYCwAAQBAJ&printsec=frontcover&img=1&zoom=5&source=gbs_api,en,http://books.google.ca/books?id=9epYCwAAQBAJ&dq=isbn:9780765385505&hl=&cd=1&source=gbs_api,CA,NOT_FOR_SALE,False,"New York Times bestselling author Seanan McGuire presents a fresh take on the portal fantasy genre that blends Alice in Wonderland, The Magicians, and The Nightmare Before Christmas."
79,['Naomi Novik'],A Deadly Education,A Novel,Del Rey Books,2021-05-04,"NEW YORK TIMES BESTSELLER - From the author of Uprooted and Spinning Silver comes the first book of the Scholomance trilogy, the story of an unwilling dark sorceress who is destined to rewrite the rules of magic. ""The dark school of magic I've been waiting for."" Katherine Arden, author of Winternight Trilogy I decided that Orion Lake needed to die after the second time he saved my life. Everyone loves Orion Lake. Everyone else, that is. Far as I'm concerned, he can keep his flashy combat magic to himself. I'm not joining his pack of adoring fans. I don't need help surviving the Scholomance, even if they do. Forget the hordes of monsters and cursed artifacts, I'm probably the most dangerous thing in the place. Just give me a chance and I'll level mountains and kill untold millions, make myself the dark queen of the world. At least, that's what the world expects. Most of the other students in here would be delighted if Orion killed me like one more evil thing that's crawled out of the drains. Sometimes I think they want me to turn into the evil witch they assume I am. The school certainly does. But the Scholomance isn't getting what it wants from me. And neither is Orion Lake. I may not be anyone's idea of the shining hero, but I'm going to make it out of this place alive, and I'm not going to slaughter thousands to do it, either. Although I'm giving serious consideration to just one. With flawless mastery, Naomi Novik creates a school bursting with magic like you've never seen before, and a heroine for the ages--a character so sharply realized and so richly nuanced that she will live on in hearts and minds for generations to come. Praise for Deadly Education ""The can't-miss fantasy of fall 2020, a brutal coming-of-power story steeped in the aesthetics of dark academia. . . . A Deadly Education will cement Naomi Novik's place as one of the greatest and most versatile fantasy writers of our time.""--BookPage (starred review) ""A must-read . . . Novik puts a refreshingly dark, adult spin on the magical boarding school. . . . Readers will delight in the push-and-pull of El and Orion's relationship, the fantastically detailed world, the clever magic system, and the matter-of-fact diversity of the student body.""--Publishers Weekly (starred review)",0593128508,9780593128503,336.0,BOOK,['Fiction'],4.0,36.0,http://books.google.com/books/content?id=qHNJzgEACAAJ&printsec=frontcover&img=1&zoom=5&source=gbs_api,en,http://books.google.ca/books?id=qHNJzgEACAAJ&dq=isbn:9780593128503&hl=&cd=1&source=gbs_api,CA,NOT_FOR_SALE,False,&quot;I decided that Orion Lake needed to die after the second time he saved my life.
80,['James Thurber'],The 13 Clocks,(Penguin Classics Deluxe Edition),Penguin,2016-08-02,"A giant of American humor makes his Penguin Classics debut with “probably the best book in the world” (Neil Gaiman, from the Introduction), in a stunning Deluxe Edition featuring the original, full-color illustrations The hands of all thirteen clocks stand still in the gloomy castle on a lonely hill where a wicked Duke lives with his niece, the beautiful Princess Saralinda. The Duke fancies he has frozen time, for he is afraid that one day a Prince may come and win away the hand of the Princess—the only warm hand in the castle. To thwart that fate, he sets impossible tasks for Saralinda’s suitors. But when the bold Prince Zorn of Zorna arrives, disguised as a wandering minstrel, and helped by the enigmatic Golux, the cold Duke may at last have met his match. Since it was first published in 1950, James Thurber’s sublimely whimsical fairy tale of love forestalled but ultimately fulfilled has delighted readers of all ages. It is published here with Marc Simont’s enchanting, full-color illustrations from the first edition. For more than seventy years, Penguin has been the leading publisher of classic literature in the English-speaking world. With more than 1,700 titles, Penguin Classics represents a global bookshelf of the best works throughout history and across genres and disciplines. Readers trust the series to provide authoritative texts enhanced by introductions and notes by distinguished scholars and contemporary authors, as well as up-to-date translations by award-winning translators.",9780143110149,9780143110149,128.0,BOOK,['Fiction'],4.0,32.0,http://books.google.com/books/content?id=HdCoDAAAQBAJ&printsec=frontcover&img=1&zoom=5&source=gbs_api,en,http://books.google.ca/books?id=HdCoDAAAQBAJ&dq=isbn:9780143110149&hl=&cd=1&source=gbs_api,CA,NOT_FOR_SALE,False,"Readers trust the series to provide authoritative texts enhanced by introductions and notes by distinguished scholars and contemporary authors, as well as up-to-date translations by award-winning translators."
81,['Ray Bradbury'],Fahrenheit 451,A Novel,Simon and Schuster,2012-01-10,"A totalitarian regime has ordered all books to be destroyed, but one of the book burners, Guy Montag, suddenly realizes their merit.",9781451673319,9781451673319,159.0,BOOK,['Fiction'],4.0,442.0,http://books.google.com/books/content?id=y3CyRurE7P4C&printsec=frontcover&img=1&zoom=5&edge=curl&source=gbs_api,en,http://books.google.ca/books?id=y3CyRurE7P4C&printsec=frontcover&dq=isbn:9781451673319&hl=&cd=1&source=gbs_api,CA,NOT_FOR_SALE,False,"A totalitarian regime has ordered all books to be destroyed, but one of the book burners, Guy Montag, suddenly realizes their merit."
82,['Ursula K. Le Guin'],The Lathe Of Heaven,A Novel,Simon and Schuster,2008-04-15,"George Orr discovers that his dreams possess the remarkable ability to change the world, and when he falls into the hands of a power-mad psychiatrist, he counters by dreaming up a perfect world that can overcome his nightmares, in a new edition of the classic science fiction novel. Reprint. 20,000 first printing.",9781416556961,9781416556961,192.0,BOOK,['Fiction'],4.0,71.0,http://books.google.com/books/content?id=sZZ7xHC3-JIC&printsec=frontcover&img=1&zoom=5&edge=curl&source=gbs_api,en,http://books.google.ca/books?id=sZZ7xHC3-JIC&printsec=frontcover&dq=isbn:9781416556961&hl=&cd=1&source=gbs_api,CA,NOT_FOR_SALE,False,"George Orr discovers that his dreams possess the remarkable ability to change the world, and when he falls into the hands of a power-mad psychiatrist, he counters by dreaming up a perfect world that can overcome his nightmares, in a new ..."
83,['Philip K. Dick'],Do Androids Dream of Electric Sheep?,,Del Rey,1996,"Captures the strange world of twenty-first-century Earth, a devastated planet in which sophisticated androids, banned from the planet, fight back against their potential destroyers",9780345404473,9780345404473,244.0,BOOK,['Fiction'],3.5,3261.0,http://books.google.com/books/content?id=3vExWrUnJB0C&printsec=frontcover&img=1&zoom=5&edge=curl&source=gbs_api,en,http://books.google.ca/books?id=3vExWrUnJB0C&printsec=frontcover&dq=isbn:9780345404473&hl=&cd=1&source=gbs_api,CA,NOT_FOR_SALE,False,"Captures the strange world of twenty-first-century Earth, a devastated planet in which sophisticated androids, banned from the planet, fight back against their potential destroyers"
84,['Philip K. Dick'],A Scanner Darkly,,Houghton Mifflin Harcourt,2011,"Bob Arctor is a junkie and a drug-dealer, both using and selling the mind-altering Substance D. Fred is a law enforcement agent, tasked with bringing Bob down. It sounds like a standard case. The only problem is that Bob and Fred are the same person. In order to infiltrate the drug ring he hopes to bring down, Fred has had to use Substance D, but Substance D, or ""Slow Death,"" causes the consciousness to split in two, creating distinct personalities that are entirely unaware of the other's existence. Now, Bob must keep from being caught by Fred, while Fred must keep his suspicious superiors at bay. In this semi-autobiographical novel, Dick looks back on his own drug abuse and his own friends who he lost to drugs. By turns thrilling, mind-bending, laught-out-loud funny, and heart-wrenchingly sad, A Scanner Darkly is an award-winning book made into a cult film and may just be Dick's best novel.",9780547572178,9780547572178,289.0,BOOK,['Fiction'],5.0,1.0,http://books.google.com/books/content?id=hg9njt3vmgQC&printsec=frontcover&img=1&zoom=5&edge=curl&source=gbs_api,en,http://books.google.ca/books?id=hg9njt3vmgQC&printsec=frontcover&dq=isbn:9780547572178&hl=&cd=1&source=gbs_api,CA,NOT_FOR_SALE,False,"In this award-winning novel, friends can become enemies, good trips can turn terrifying, and cops and criminals are two sides of the same coin."
85,['Philip K. Dick'],Ubik,,Houghton Mifflin Harcourt,2012,"A dead man sends haunting warnings back from the grave, and Joe Chip must solve these mysteries to determine his own real or surreal existence.",9780547572291,9780547572291,227.0,BOOK,['FICTION'],3.5,65.0,http://books.google.com/books/content?id=SlNIxp0uSR0C&printsec=frontcover&img=1&zoom=5&edge=curl&source=gbs_api,en,http://books.google.ca/books?id=SlNIxp0uSR0C&printsec=frontcover&dq=isbn:9780547572291&hl=&cd=1&source=gbs_api,CA,NOT_FOR_SALE,False,"A dead man sends haunting warnings back from the grave, and Joe Chip must solve these mysteries to determine his own real or surreal existence."
86,['Philip K. Dick'],Martian Time-Slip,,Mariner Books,2012,"Mars is not a happy place—a planet for exiles, drifters, and psychics, who would otherwise be executed. One such psychic is a ten-year-old boy named Manfred, a boy so powerful he not only looks into the future, but can send people there. But with the turbulent politics of Mars, that future might not be any better than the present. This twisty novel from Philip K. Dick is combines political intrigue, time travel, family drama, and all the perils that come with being the first at anything.",0547572573,9780547572574,278.0,BOOK,['Fiction'],4.0,17.0,http://books.google.com/books/content?id=ijBftQAACAAJ&printsec=frontcover&img=1&zoom=5&source=gbs_api,en,http://books.google.ca/books?id=ijBftQAACAAJ&dq=isbn:9780547572574&hl=&cd=1&source=gbs_api,CA,NOT_FOR_SALE,False,"This twisty novel from Philip K. Dick is combines political intrigue, time travel, family drama, and all the perils that come with being the first at anything."
87,['Frank Herbert'],Dune,,Ace Books,2019,"A deluxe hardcover edition of the bestselling science-fiction book of all time--part of Penguin Galaxy, a collectible series of six sci-fi/fantasy classics.sics.",9780593099322,9780593099322,688.0,BOOK,['Fiction'],,,http://books.google.com/books/content?id=-hmtDwAAQBAJ&printsec=frontcover&img=1&zoom=5&source=gbs_api,en,http://books.google.ca/books?id=-hmtDwAAQBAJ&dq=isbn:9780593099322&hl=&cd=1&source=gbs_api,CA,NOT_FOR_SALE,False,"A deluxe hardcover edition of the bestselling science-fiction book of all time--part of Penguin Galaxy, a collectible series of six sci-fi/fantasy classics.sics."
88,['John Boyne'],The Boy in the Striped Pajamas,A Fable,"Random House Digital, Inc.",2006,"Bored and lonely after his family moves from Berlin to a place called ""Out-With"" in 1942, Bruno, the son of a Nazi officer, befriends a boy in striped pajamas who lives behind a wire fence.",9780385751063,9780385751063,215.0,BOOK,['Juvenile Fiction'],4.5,53.0,http://books.google.com/books/content?id=yK7jrmsqJ20C&printsec=frontcover&img=1&zoom=5&edge=curl&source=gbs_api,en,http://books.google.ca/books?id=yK7jrmsqJ20C&printsec=frontcover&dq=isbn:9780385751063&hl=&cd=1&source=gbs_api,CA,NOT_FOR_SALE,False,"Bored and lonely after his family moves from Berlin to a place called &quot;Out-With&quot; in 1942, Bruno, the son of a Nazi officer, befriends a boy in striped pajamas who lives behind a wire fence."
89,,,,,,,,9780771009471,,,,,,,,,,,,
90,['Joseph Heller'],Catch-22,50th Anniversary Edition,Simon & Schuster,2011-04-05,"Fifty years after its original publication, Catch-22 remains a cornerstone of American literature and one of the funniest—and most celebrated—books of all time. In recent years it has been named to “best novels” lists by Time, Newsweek, the Modern Library, and the London Observer. Set in Italy during World War II, this is the story of the incomparable, malingering bombardier, Yossarian, a hero who is furious because thousands of people he has never met are trying to kill him. But his real problem is not the enemy—it is his own army, which keeps increasing the number of missions the men must fly to complete their service. Yet if Yossarian makes any attempt to excuse himself from the perilous missions he’s assigned, he’ll be in violation of Catch-22, a hilariously sinister bureaucratic rule: a man is considered insane if he willingly continues to fly dangerous combat missions, but if he makes a formal request to be removed from duty, he is proven sane and therefore ineligible to be relieved. This fiftieth-anniversary edition commemorates Joseph Heller’s masterpiece with a new introduction by Christopher Buckley; a wealth of critical essays and reviews by Norman Mailer, Alfred Kazin, Anthony Burgess, and others; rare papers and photos from Joseph Heller’s personal archive; and much more. Here, at last, is the definitive edition of a classic of world literature.",1451626657,9781451626650,544.0,BOOK,['Fiction'],,,http://books.google.com/books/content?id=t9iccQAACAAJ&printsec=frontcover&img=1&zoom=5&source=gbs_api,en,http://books.google.ca/books?id=t9iccQAACAAJ&dq=isbn:9781451626650&hl=&cd=1&source=gbs_api,CA,NOT_FOR_SALE,False,"This fiftieth-anniversary edition commemorates Joseph Heller’s masterpiece with a new introduction; critical essays and reviews by Norman Mailer, Alfred Kazin, Anthony Burgess, and others; rare papers and photos; and much more."
91,['Agatha Christie'],Little Grey Cells,The Quotable Poirot,William Morrow,2016-10-25,"A charming, beautifully designed collection of bite-sized wisdom from Agatha Christie’s beloved detective Hercule Poirot—delightful, witty, and perceptive quotations and bon mots to stimulate every fan’s little grey cells. “My name is Hercule Poirot and I am probably the greatest detective in the world.” Perhaps the most famous detective of all time worldwide, Hercule Poirot is one of the most unique characters ever created. Fastidious, faint of stomach, a literal egghead, and a perpetual curser of patent leather shoes—the French-speaking Belgian may have his eccentricities, but he is also brilliant and full of wisdom both practical and timeless. Now, for the first time ever, all of your favorite pearls of Poirot are collected in one handy volume. With Little Grey Cells, you yourself will be able to solve all of life’s mysteries.",006242517X,9780062425171,160.0,BOOK,['Fiction'],,,http://books.google.com/books/content?id=W8xTrgEACAAJ&printsec=frontcover&img=1&zoom=5&source=gbs_api,en,http://books.google.ca/books?id=W8xTrgEACAAJ&dq=isbn:9780062425171&hl=&cd=1&source=gbs_api,CA,NOT_FOR_SALE,False,"Sometimes funny, often profound, and always revealing, this book of quotes and comments from more than fifty Poirot novels and short stories gives an entertaining glimpse of the man behind the moustache, and the wit and wisdom of the Queen ..."
92,['Ray Bradbury'],The Martian Chronicles,,Simon and Schuster,2012-04-17,"The tranquility of Mars is disrupted by humans who want to conquer space, colonize the planet, and escape a doomed Earth.",9781451678192,9781451678192,241.0,BOOK,['Fiction'],4.0,137.0,http://books.google.com/books/content?id=HzQXlPS48PQC&printsec=frontcover&img=1&zoom=5&edge=curl&source=gbs_api,en,http://books.google.ca/books?id=HzQXlPS48PQC&printsec=frontcover&dq=isbn:9781451678192&hl=&cd=1&source=gbs_api,CA,NOT_FOR_SALE,False,"Bradbury&#39;s Mars is a place of hope, dreams and metaphor - of crystal pillars and fossil seas - where a fine dust settles on the great, empty cities of a silently destroyed civilization."
93,,,,,,,,4784067471046,,,,,,,,,,,,
94,['Anthony Burgess'],A Clockwork Orange,,,2013,"Fifteen-year-old Alex likes lashings of ultraviolence. He and his gang of friends rob, kill and rape their way through a nightmarish future, until the State puts a stop to his riotous excesses. But what will his re-education mean?",0141197536,9780141197531,306.0,BOOK,['Juvenile delinquency'],,,http://books.google.com/books/content?id=PaB7nAEACAAJ&printsec=frontcover&img=1&zoom=5&source=gbs_api,en,http://books.google.ca/books?id=PaB7nAEACAAJ&dq=isbn:9780141197531&hl=&cd=1&source=gbs_api,CA,NOT_FOR_SALE,False,"This critical edition restores the text of the novel as Anthony Burgess originally wrote it, and includes a glossary of the teen slang &#39;Nadsat&#39;, explanatory notes, pages from the original typescript, interviews, articles and reviews, ..."
95,['Kazuo Ishiguro'],Never Let Me Go,,Vintage Books Canada,2010-08-31,A meditation on mortality and lost innocence: a portrait of adolescence as that hinge moment in life when self-knowledge brings intimations of one's destiny.,9780307400994,9780307400994,304.0,BOOK,['Cloning'],3.5,487.0,http://books.google.com/books/content?id=l2tgn7DGaP4C&printsec=frontcover&img=1&zoom=5&edge=curl&source=gbs_api,en,http://books.google.ca/books?id=l2tgn7DGaP4C&printsec=frontcover&dq=isbn:9780307400994&hl=&cd=1&source=gbs_api,CA,NOT_FOR_SALE,False,A meditation on mortality and lost innocence: a portrait of adolescence as that hinge moment in life when self-knowledge brings intimations of one&#39;s destiny.
96,['Agatha Christie'],Murder on the Orient Express Facsimile Edition,,William Morrow,2015-10-06,"A stunning facsimile edition of the original Agatha Christie hardcover—the legendary author’s most famous book, and Hercule Poirot’s most famous case. Just after midnight, a snowdrift stopped the Orient Express in its tracks. The luxurious train was surprisingly full for the time of the year. But by the morning there was one passenger fewer. An American lay dead in his compartment, stabbed a dozen times, his door locked from the inside. With tension mounting, detective Hercule Poirot comes up with not one, but two solutions to the crime. Reproducing the original typesetting and format of the first edition from the Christie family’s archive, Murder on the Orient Express Facsimile Edition also features the first hardcover edition’s actual cover art, which has been painstakingly restored to its original beauty.",0062424750,9780062424754,256.0,BOOK,['Fiction'],,,http://books.google.com/books/content?id=mYZArgEACAAJ&printsec=frontcover&img=1&zoom=5&source=gbs_api,en,http://books.google.ca/books?id=mYZArgEACAAJ&dq=isbn:9780062424754&hl=&cd=1&source=gbs_api,CA,NOT_FOR_SALE,False,"Reproducing the original typesetting and format of the first edition from the Christie family’s archive, Murder on the Orient Express Facsimile Edition also features the first hardcover edition’s actual cover art, which has been ..."
97,['Agatha Christie'],And Then There Were None Facsimile Edition,,William Morrow,2016-11-29,"A beautiful, collectible facsimile edition of Agatha Christie’s most famous book and the bestselling mystery in the world. ""Ten . . ."" Ten strangers are lured to an isolated island mansion off the Devon coast by a mysterious ""U. N. Owen."" ""Nine . . ."" At dinner a recorded message accuses each of them in turn of having a guilty secret, and by the end of the night one of the guests is dead. ""Eight . . ."" Stranded by a violent storm, and haunted by a nursery rhyme counting down one by one . . . as one by one . . . they begin to die. ""Seven . . ."" Which among them is the killer and will any of them survive? Featuring the original typesetting and format of the first edition from the Christie family’s archive, And Then There Were None Facsimile Edition is packaged with the first hardcover edition’s actual cover art, which has been painstakingly restored to its original beauty.",0062484397,9780062484390,272.0,BOOK,['Fiction'],,,http://books.google.com/books/content?id=J5dxjwEACAAJ&printsec=frontcover&img=1&zoom=5&source=gbs_api,en,http://books.google.ca/books?id=J5dxjwEACAAJ&dq=isbn:9780062484390&hl=&cd=1&source=gbs_api,CA,NOT_FOR_SALE,False,"Featuring the original typesetting and format of the first edition from the Christie family’s archive, And Then There Were None Facsimile Edition is packaged with the first hardcover edition’s actual cover art, which has been ..."
