,Authors,Title,Subtitle,Publisher,Date Published,Description,ISBN-10,ISBN-13,Page Count,Print Type,Genres,Average Rating,Ratings Count,Image Link,Language,Preview Link,Sale Country,Saleability,E-Book,Summary
36,['John Scalzi'],Old Man's War,,Tor Books,2017-10-17,"Enlisting in the army on his seventy-fifth birthday, John Perry joins an interstellar war between Earth and alien enemies who would stake claims on the few existing inhabitable planets, unaware that the conflict involves much more than he understands.",9780765394859,9780765394859,416.0,BOOK,['Fiction'],4.0,184.0,http://books.google.com/books/content?id=iaM7DwAAQBAJ&printsec=frontcover&img=1&zoom=5&source=gbs_api,en,http://books.google.ca/books?id=iaM7DwAAQBAJ&dq=isbn:9780765394859&hl=&cd=1&source=gbs_api,CA,NOT_FOR_SALE,False,A stunning novel of the long war for human survival--in a universe replete with hostility
37,['John Scalzi'],Lock In,A Novel of the Near Future,Tor Science Fiction,2015-08-04,"A blazingly inventive near-future thriller from the best-selling, Hugo Award-winning John Scalzi. Not too long from today, a new, highly contagious virus makes its way across the globe. Most who get sick experience nothing worse than flu, fever and headaches. But for the unlucky one percent - and nearly five million souls in the United States alone - the disease causes ""Lock In"": Victims fully awake and aware, but unable to move or respond to stimulus. The disease affects young, old, rich, poor, people of every color and creed. The world changes to meet the challenge. A quarter of a century later, in a world shaped by what's now known as ""Haden's syndrome,"" rookie FBI agent Chris Shane is paired with veteran agent Leslie Vann. The two of them are assigned what appears to be a Haden-related murder at the Watergate Hotel, with a suspect who is an ""integrator"" - someone who can let the locked in borrow their bodies for a time. If the Integrator was carrying a Haden client, then naming the suspect for the murder becomes that much more complicated. But ""complicated"" doesn't begin to describe it. As Shane and Vann began to unravel the threads of the murder, it becomes clear that the real mystery - and the real crime - is bigger than anyone could have imagined. The world of the locked in is changing, and with the change comes opportunities that the ambitious will seize at any cost. The investigation that began as a murder case takes Shane and Vann from the halls of corporate power to the virtual spaces of the locked in, and to the very heart of an emerging, surprising new human culture. It's nothing you could have expected.",076538132X,9780765381323,336.0,BOOK,['Fiction'],4.0,80.0,http://books.google.com/books/content?id=NRzqoQEACAAJ&printsec=frontcover&img=1&zoom=5&source=gbs_api,en,http://books.google.ca/books?id=NRzqoQEACAAJ&dq=isbn:9780765381323&hl=&cd=1&source=gbs_api,CA,NOT_FOR_SALE,False,Old Man&#39;s War Series #1 Old Man’s War #2 The Ghost Brigades #3 The Last Colony #4 Zoe’s Tale #5 The Human Division #6 The End of All Things Short fiction: “After the Coup” Other Tor Books The Android’s Dream Agent to the Stars ...
38,['Daniel Keyes'],Flowers for Algernon,,Houghton Mifflin Harcourt,2004,Oscar-winning film Charly starring Cliff Robertson and Claire Bloom-a mentally challenged man receives an operation that turns him into a genius...and introduces him to heartache.,9780156030083,9780156030083,311.0,BOOK,['Fiction'],4.0,179.0,http://books.google.com/books/content?id=6P_jN6zUuMcC&printsec=frontcover&img=1&zoom=5&edge=curl&source=gbs_api,en,http://books.google.ca/books?id=6P_jN6zUuMcC&printsec=frontcover&dq=isbn:9780156030083&hl=&cd=1&source=gbs_api,CA,NOT_FOR_SALE,False,"WINNER OF THE HUGO AWARD AND THE NEBULA AWARD The classic novel that inspired the Academy Award-winning movie Charly Daniel Keyes, the author of eight books, was born in Brooklyn, New York, and received his B.A. and M.A. degrees from ..."
39,['Douglas Adams'],Long Dark Tea-Time of the Soul,,Simon and Schuster,1990,"When a passenger check-in desk shoots through the roof of a terminal at Heathrow Airport in flames, Dirk Gently investigates the cosmic forces at play",9780671742515,9780671742515,307.0,BOOK,['Fiction'],4.0,8.0,http://books.google.com/books/content?id=h7pjdEPBeGUC&printsec=frontcover&img=1&zoom=5&edge=curl&source=gbs_api,en,http://books.google.ca/books?id=h7pjdEPBeGUC&printsec=frontcover&dq=isbn:9780671742515&hl=&cd=1&source=gbs_api,CA,NOT_FOR_SALE,False,"When a passenger check-in desk shoots through the roof of a terminal at Heathrow Airport in flames, Dirk Gently investigates the cosmic forces at play"
40,['Orson Scott Card'],Pastwatch,The Redemption of Christopher Columbus,Tor Science Fiction,1997-02-15,"In one of the most powerful and thought-provoking novels of his remarkable career, Orson Scott Card interweaves a compelling portrait of Christopher Columbus with the story of a future scientist who believes she can alter human history from a tragedy of bloodshed and brutality to a world filled with hope and healing.",0812508645,9780812508642,416.0,BOOK,['Fiction'],4.0,30.0,http://books.google.com/books/content?id=PH7QmAEACAAJ&printsec=frontcover&img=1&zoom=5&source=gbs_api,en,http://books.google.ca/books?id=PH7QmAEACAAJ&dq=isbn:9780812508642&hl=&cd=1&source=gbs_api,CA,NOT_FOR_SALE,False,"In one of the most powerful and thought-provoking novels of his remarkable career, Orson Scott Card&#39;s Pastwatch interweaves a compelling portrait of Christopher Columbus with the story of a future scientist who believes she can alter human ..."
41,['Orson Scott Card'],Seventh Son,The Tales of Alvin Maker,Tor Fantasy,1993-06-15,"American Library Association ""Best Books for Young Adults"" From the author of Ender's Game, an unforgettable story about young Alvin Maker: the seventh son of a seventh son. Born into an alternative frontier America where life is hard and folk magic is real, Alvin is gifted with the power. He must learn to use his gift wisely. But dark forces are arrayed against Alvin, and only a young girl with second sight can protect him. Includes an excerpt of Orson Scott Card's new novel, THE LOST GATE! The Tales of Alvin Maker series Seventh Son Red Prophet Prentice Alvin Alvin Journeyman Heartfire The Crystal City",0812533054,9780812533057,256.0,BOOK,['Fiction'],3.5,30.0,http://books.google.com/books/content?id=tNYTmAEACAAJ&printsec=frontcover&img=1&zoom=5&source=gbs_api,en,http://books.google.ca/books?id=tNYTmAEACAAJ&dq=isbn:9780812533057&hl=&cd=1&source=gbs_api,CA,NOT_FOR_SALE,False,"A tribute to the art of storytelling, this is highly recommended.&quot; —Library Journal &quot;This beguiling book recalls Robert Penn Warren in its robust blend of folktale, history, parable, personal testimony, and pioneer narrative.&quot; ..."
42,['Orson Scott Card'],Children of the Mind,,Turtleback Books,1997,"In the conclusion of the Ender saga, Ender Wiggin confronts his ultimate challenge when his adopted world, Lusitania, is threatened by his old planet-destroying weapon, and his ally, Jane, is about to be killed off by the Starways Congress",UOM:49015003059152,9780812522396,370.0,BOOK,['Fiction'],3.0,11.0,http://books.google.com/books/content?id=guUOAQAAMAAJ&printsec=frontcover&img=1&zoom=5&source=gbs_api,en,http://books.google.ca/books?id=guUOAQAAMAAJ&dq=isbn:9780812522396&hl=&cd=1&source=gbs_api,CA,NOT_FOR_SALE,False,"In the conclusion of the Ender saga, Ender Wiggin confronts his ultimate challenge when his adopted world, Lusitania, is threatened by his old planet-destroying weapon, and his ally, Jane, is about to be killed off by the Starways Congress"
43,['Orson Scott Card'],Xenocide,Volume Three of the Ender Quintet,Tor Books,1992-08-15,"The war for survival of the planet Lusitania will be fought in the heart of a child named Gloriously Bright. On Lusitania, Ender found a world where humans and pequininos and the Hive Queen could all live together; where three very different intelligent species could find common ground at last. Or so he thought. Lusitania also harbors the descolada, a virus that kills all humans it infects, but which the pequininos require in order to become adults. The Startways Congress so fears the effects of the descolada, should it escape from Lusitania, that they have ordered the destruction of the entire planet, and all who live there. The Fleet is on its way, a second xenocide seems inevitable. Xenocide is the third novel in Orson Scott Card's Ender Quintet. THE ENDER UNIVERSE Ender series Ender’s Game / Ender in Exile / Speaker for the Dead / Xenocide / Children of the Mind Ender’s Shadow series Ender’s Shadow / Shadow of the Hegemon / Shadow Puppets / Shadow of the Giant / Shadows in Flight Children of the Fleet The First Formic War (with Aaron Johnston) Earth Unaware / Earth Afire / Earth Awakens The Second Formic War (with Aaron Johnston) The Swarm /The Hive Ender novellas A War of Gifts /First Meetings",0812509250,9780812509250,608.0,BOOK,['Fiction'],4.0,1.0,,en,http://books.google.ca/books?id=K__yzAEACAAJ&dq=isbn:9780812509250&hl=&cd=1&source=gbs_api,CA,NOT_FOR_SALE,False,"The Fleet is on its way, a second xenocide seems inevitable. Xenocide is the third novel in Orson Scott Card&#39;s Ender Quintet."
44,['Orson Scott Card'],Ender's Game,,Tor Science Fiction,1994-07-15,"From New York Times bestselling author Orson Scott Card, Ender's Game is the classic Hugo and Nebula award-winning science fiction novel of a young boy's recruitment into the midst of an interstellar war. In order to develop a secure defense against a hostile alien race's next attack, government agencies breed child geniuses and train them as soldiers. A brilliant young boy, Andrew ""Ender"" Wiggin lives with his kind but distant parents, his sadistic brother Peter, and the person he loves more than anyone else, his sister Valentine. Peter and Valentine were candidates for the soldier-training program but didn't make the cut—young Ender is the Wiggin drafted to the orbiting Battle School for rigorous military training. Ender's skills make him a leader in school and respected in the Battle Room, where children play at mock battles in zero gravity. Yet growing up in an artificial community of young soldiers Ender suffers greatly from isolation, rivalry from his peers, pressure from the adult teachers, and an unsettling fear of the alien invaders. His psychological battles include loneliness, fear that he is becoming like the cruel brother he remembers, and fanning the flames of devotion to his beloved sister. Is Ender the general Earth needs? But Ender is not the only result of the genetic experiments. The war with the Buggers has been raging for a hundred years, and the quest for the perfect general has been underway for almost as long. Ender's two older siblings are every bit as unusual as he is, but in very different ways. Between the three of them lie the abilities to remake a world. If, that is, the world survives. Orson Scott Card's Ender's Game is the winner of the 1985 Nebula Award for Best Novel and the 1986 Hugo Award for Best Novel. THE ENDER UNIVERSE Ender Quintet series Ender’s Game / Ender in Exile / Speaker for the Dead / Xenocide / Children of the Mind Ender’s Shadow series Ender’s Shadow / Shadow of the Hegemon / Shadow Puppets / Shadow of the Giant / Shadows in Flight Children of the Fleet The First Formic War (with Aaron Johnston) Earth Unaware / Earth Afire / Earth Awakens The Second Formic War (with Aaron Johnston) The Swarm /The Hive Ender novellas A War of Gifts /First Meetings",0812550706,9780812550702,352.0,BOOK,['Fiction'],4.0,3382.0,http://books.google.com/books/content?id=5tCSc9pZPBwC&printsec=frontcover&img=1&zoom=5&source=gbs_api,en,http://books.google.ca/books?id=5tCSc9pZPBwC&dq=isbn:9780812550702&hl=&cd=1&source=gbs_api,CA,NOT_FOR_SALE,False,"Between the three of them lie the abilities to remake a world. If, that is, the world survives. Orson Scott Card&#39;s Ender&#39;s Game is the winner of the 1985 Nebula Award for Best Novel and the 1986 Hugo Award for Best Novel."
45,"['Orson Scott Card', 'Jake Black']",The Authorized Ender Companion,,Tor Books,2011-12-06,"The Authorized Ender Companion is a complete and in-depth encyclopedia of all the persons, places, things, and events in Orson Scott Card’s Ender Universe. Written by Jake Black under the editorial supervision of Card himself, The Authorized Ender Companion will be an invaluable resource for readers of the series. If you ever wondered where Ender went after he left Earth, before he arrived at Lusitania, you’ll find the answer here. If you ever wanted to know how the battle room worked, you’ll find the answer here. If you forgot the names of the people who discovered the descolada, the answer is here. The history of Gloriously Bright’s world? Here. The Authorized Ender Companion contains all this and more. There are character biographies, time lines, colony histories, family trees, and numerous black and white illustrations.",0765320630,9780765320636,432.0,BOOK,['Fiction'],,,http://books.google.com/books/content?id=-I5szgAACAAJ&printsec=frontcover&img=1&zoom=5&source=gbs_api,en,http://books.google.ca/books?id=-I5szgAACAAJ&dq=isbn:9780765320636&hl=&cd=1&source=gbs_api,CA,NOT_FOR_SALE,False,"Written by Jake Black under the editorial supervision of Card himself, The Authorized Ender Companion will be an invaluable resource for readers of the series."
46,['Riot Games'],League of Legends: Realms of Runeterra (Official Companion),,Voracious,2019-11-05,"Unlock the mysteries and magic within League of Legends, one of the world's most popular video games, in this encyclopedic and collectible companion book that explores the game's epic lore. Embark on a journey through the realms of Runeterra in this first-ever collectible companion book, published to celebrate the game's tenth anniversary. Spanning the farthest reaches of this universe and venturing into uncharted territory, this encyclopedic compendium connects players to the rich storytelling that inspires all the action. Inside, you'll find: An expedition through eleven regions, chronicling conflicts, entrenched rivalries, and covert alliances Hundreds of illustrations, including never-before-seen maps and artwork Insights into the heroes, flora, fauna, architecture, politics, and technologies from all corners of this world Original narratives that bring the cultures of Runeterra to life League of Legends is an online game played by millions of people around the world, offering endless engagement with an expanding roster of champions, frequent updates, and a thriving esports scene. This volume is an essential reference for fans everywhere.",0316497320,9780316497329,256.0,BOOK,['Games & Activities'],,,http://books.google.com/books/content?id=K55uyAEACAAJ&printsec=frontcover&img=1&zoom=5&source=gbs_api,en,http://books.google.ca/books?id=K55uyAEACAAJ&dq=isbn:9780316497329&hl=&cd=1&source=gbs_api,CA,NOT_FOR_SALE,False,This volume is an essential reference for fans everywhere.
47,['Pam Brandon'],Cooking with Mickey and the Disney Chefs (WDW custom pub),,Disney Editions,2004-05-01,,078685331X,9780786853311,160.0,BOOK,['Juvenile Nonfiction'],,,,en,http://books.google.ca/books?id=-i2LkgEACAAJ&dq=isbn:9780786853311&hl=&cd=1&source=gbs_api,CA,NOT_FOR_SALE,False,
48,"['Gordon Ramsay', 'Roz Denny']",Chef for All Seasons,,Quadrille Publishing,2010,"This book shows how using the very best of seasonal ingredients and combining them sensitively in innovative combinations can create modern flavourful dishes. With this superlative mixture of fresh ingredients, culinary advice, innovative combinations and mouthwatering recipes Gordon proves that he is a chef for all seasons.",1844008762,9781844008766,224.0,BOOK,['Cooking'],4.5,4.0,http://books.google.com/books/content?id=AxUMRQAACAAJ&printsec=frontcover&img=1&zoom=5&source=gbs_api,en,http://books.google.ca/books?id=AxUMRQAACAAJ&dq=isbn:9781844008766&hl=&cd=1&source=gbs_api,CA,NOT_FOR_SALE,False,This book shows how using the very best of seasonal ingredients and combining them sensitively in innovative combinations can create modern flavourful dishes.
49,['Pam Brandon'],Chef Mickey (Walt Disney Parks and Resorts merchandise custom pub),,Disney Editions,2010-11-03,"Recipes from Walt Disney World and Disneylan, new and old. Created exclusivly for Walt Disney Parks and Resorts merchandise.",142312782X,9781423127826,192.0,BOOK,['Cooking'],,,,en,http://books.google.ca/books?id=ssh8kQEACAAJ&dq=isbn:9781423127826&hl=&cd=1&source=gbs_api,CA,NOT_FOR_SALE,False,"Recipes from Walt Disney World and Disneylan, new and old. Created exclusivly for Walt Disney Parks and Resorts merchandise."
50,['Steven S. Skiena'],The Data Science Design Manual,,Springer,2017-07-30,"This engaging and clearly written textbook/reference provides a must-have introduction to the rapidly emerging interdisciplinary field of data science. It focuses on the principles fundamental to becoming a good data scientist and the key skills needed to build systems for collecting, analyzing, and interpreting data. The Data Science Design Manual is a source of practical insights that highlights what really matters in analyzing data, and provides an intuitive understanding of how these core concepts can be used. The book does not emphasize any particular programming language or suite of data-analysis tools, focusing instead on high-level discussion of important design principles. This easy-to-read text ideally serves the needs of undergraduate and early graduate students embarking on an “Introduction to Data Science” course. It reveals how this discipline sits at the intersection of statistics, computer science, and machine learning, with a distinct heft and character of its own. Practitioners in these and related fields will find this book perfect for self-study as well. Additional learning tools: Contains “War Stories,” offering perspectives on how data science applies in the real world Includes “Homework Problems,” providing a wide range of exercises and projects for self-study Provides a complete set of lecture slides and online video lectures at www.data-manual.com Provides “Take-Home Lessons,” emphasizing the big-picture concepts to learn from each chapter Recommends exciting “Kaggle Challenges” from the online platform Kaggle Highlights “False Starts,” revealing the subtle reasons why certain approaches fail Offers examples taken from the data science television show “The Quant Shop” (www.quant-shop.com)",3319554433,9783319554433,445.0,BOOK,['Computers'],,,http://books.google.com/books/content?id=YrRQAQAACAAJ&printsec=frontcover&img=1&zoom=5&source=gbs_api,en,http://books.google.ca/books?id=YrRQAQAACAAJ&dq=isbn:9783319554433&hl=&cd=1&source=gbs_api,CA,NOT_FOR_SALE,False,Practitioners in these and related fields will find this book perfect for self-study as well.
51,['Liberty Vittert'],30-Second Data Science,"The 50 Key Principles and Innovations in the Field of Data-Gathering, Each Explained in Half a Minute",30 Second,2020-09-29,"30-Second Data Science is the quickest way to discover how data is a driving force not just in the big issues, such as climate change and healthcare, but in our daily lives. Data science is an entirely new discipline that encompasses a new era of information, from finding criminals to predicting epidemics. But there's more to it than the vast quantities of information gathered by our computers, smartphones, and credit cards. Carefully compiled by experts in the field, 30-Second Data Science covers the basic statistical principles that drive the algorithms, how data affects us in every way--science, society, business, pleasure--along with the ethical quandaries and its future promise of a better world. Each 30-Second entry details a different facet of data science in just 300 words and one picture, showing how the concept of bringing together different types of data, and using powerful computer programs to find patterns no human eye could spot, is already transforming our world. Exploring key ideas and featuring biographies of the people behind them, 30-Second Data Science explains clearly and concisely all you need to know about data science, from basics to ethics.",9780711259669,9780711259669,160.0,BOOK,['Computers'],,,http://books.google.com/books/content?id=6sz-DwAAQBAJ&printsec=frontcover&img=1&zoom=5&edge=curl&source=gbs_api,en,http://books.google.ca/books?id=6sz-DwAAQBAJ&printsec=frontcover&dq=isbn:9780711259669&hl=&cd=1&source=gbs_api,CA,NOT_FOR_SALE,False,"30-Second Data Science is the quickest way to discover how data is a driving force not just in the big issues, such as climate change and healthcare, but in our daily lives."
52,"['Peter Bruce', 'Andrew Bruce', 'Peter Gedeck']",Practical Statistics for Data Scientists,50+ Essential Concepts Using R and Python,O'Reilly Media,2020-06-09,"Statistical methods are a key part of data science, yet few data scientists have formal statistical training. Courses and books on basic statistics rarely cover the topic from a data science perspective. The second edition of this practical guide--now including examples in Python as well as R--explains how to apply various statistical methods to data science, tells you how to avoid their misuse, and gives you advice on what's important and what's not. Many data scientists use statistical methods but lack a deeper statistical perspective. If you're familiar with the R or Python programming languages, and have had some exposure to statistics but want to learn more, this quick reference bridges the gap in an accessible, readable format. With this updated edition, you'll dive into: Exploratory data analysis Data and sampling distributions Statistical experiments and significance testing Regression and prediction Classification Statistical machine learning Unsupervised learning",149207294X,9781492072942,350.0,BOOK,['Computers'],,,http://books.google.com/books/content?id=xdEMywEACAAJ&printsec=frontcover&img=1&zoom=5&source=gbs_api,en,http://books.google.ca/books?id=xdEMywEACAAJ&dq=isbn:9781492072942&hl=&cd=1&source=gbs_api,CA,NOT_FOR_SALE,False,"With this updated edition, you&#39;ll dive into: Exploratory data analysis Data and sampling distributions Statistical experiments and significance testing Regression and prediction Classification Statistical machine learning Unsupervised ..."
53,['Terry Brooks'],The Wishsong of Shannara,,Del Rey,2015,"Horror stalks the Four Lands. The Ildatch, immemorial book of evil spells, has stirred to eldritch life, sending its foul Mord wraiths to accomplish at last mankind's destruction. Only Jair and Brin can attempt to halt the resulting evil",9781101965610,9781101965610,576.0,BOOK,['Elves'],3.5,18.0,http://books.google.com/books/content?id=poHaCwAAQBAJ&printsec=frontcover&img=1&zoom=5&edge=curl&source=gbs_api,en,http://books.google.ca/books?id=poHaCwAAQBAJ&printsec=frontcover&dq=isbn:9781101965610&hl=&cd=1&source=gbs_api,CA,NOT_FOR_SALE,False,"Horror stalks the Four Lands. The Ildatch, immemorial book of evil spells, has stirred to eldritch life, sending its foul Mord wraiths to accomplish at last mankind&#39;s destruction. Only Jair and Brin can attempt to halt the resulting evil"
54,['Brian Catling'],The Vorrh,A Novel,Vintage,2015,"In a novel that combines history and fantasy, the author explores the Vorrh, a vast forest at the edge of Essenwald, a colonial city in a parallel Africa. Original.",9781101873786,9781101873786,500.0,BOOK,['Fiction'],3.5,9.0,http://books.google.com/books/content?id=O1uNDQAAQBAJ&printsec=frontcover&img=1&zoom=5&edge=curl&source=gbs_api,en,http://books.google.ca/books?id=O1uNDQAAQBAJ&printsec=frontcover&dq=isbn:9781101873786&hl=&cd=1&source=gbs_api,CA,NOT_FOR_SALE,False,"In a novel that combines history and fantasy, the author explores the Vorrh, a vast forest at the edge of Essenwald, a colonial city in a parallel Africa. Original."
55,['Neal Stephenson'],Snow Crash,,Bantam Press,2003,"In twenty-first-century America, a teenaged computer hacker finds himself fighting a computer virus that battles virtual reality technology and a deadly drug that turns humans into zombies.",0553380958,9780553380958,470.0,BOOK,['Fiction'],4.0,320.0,http://books.google.com/books/content?id=mqpvVydYo-8C&printsec=frontcover&img=1&zoom=5&source=gbs_api,en,http://books.google.ca/books?id=mqpvVydYo-8C&dq=isbn:9780553380958&hl=&cd=1&source=gbs_api,CA,NOT_FOR_SALE,False,"In twenty-first-century America, a teenaged computer hacker finds himself fighting a computer virus that battles virtual reality technology and a deadly drug that turns humans into zombies."
