,Authors,Title,Subtitle,Publisher,Date Published,Description,ISBN-10,ISBN-13,Page Count,Print Type,Genres,Average Rating,Ratings Count,Image Link,Language,Preview Link,Sale Country,Saleability,E-Book,Summary
117,['J. K. Rowling'],Harry Potter and the Chamber of Secrets,,Raincoast Books,2000,"Harry, Ron, and Hermione are back for their second year at Hogwarts School of Witchcraft and Wizardry. Soon the threesome are immersed in the daily rounds of Potions, Herbology, Charms, Defence Against the Black Arts, and playing Quidditch. But then, terrible things begin to happen ... Harry hears voices, and sinister messages appear on the walls. Even worse, everyone thinks it's Harry's fault!",155192370X,9781551923703,251.0,BOOK,['Boarding schools'],4.5,2270.0,http://books.google.com/books/content?id=Fkk9PgAACAAJ&printsec=frontcover&img=1&zoom=5&source=gbs_api,en,http://books.google.ca/books?id=Fkk9PgAACAAJ&dq=isbn:9781551923703&hl=&cd=1&source=gbs_api,CA,NOT_FOR_SALE,False,"Harry, Ron, and Hermione are back for their second year at Hogwarts School of Witchcraft and Wizardry."
118,['J. K. Rowling'],Harry Potter and the Prisoner of Azkaban,,Bloomsbury Publishing,2010-01-01,"When Harry, along with his best friends Ron and Hermione, go back for their third year at Hogwarts, the atmosphere is tense. There's an escaped mass murderer on the loose, and the sinister prison guards of Azkaban have been called in to guard the school.",1408810565,9781408810569,317.0,BOOK,"[""Children's stories""]",4.5,2128.0,http://books.google.com/books/content?id=FcL2RQAACAAJ&printsec=frontcover&img=1&zoom=5&source=gbs_api,en,http://books.google.ca/books?id=FcL2RQAACAAJ&dq=isbn:9781408810569&hl=&cd=1&source=gbs_api,CA,NOT_FOR_SALE,False,"During his third year at Hogwarts School for Witchcraft and Wizardry, Harry Potter must confront the devious and dangerous wizard responsible for his parents&#39; deaths."
119,,,,,,,,9780439358071,,,,,,,,,,,,
120,,,,,,,,9780439785969,,,,,,,,,,,,
121,['J. K. Rowling'],Harry Potter and the Deathly Hallows,,Arthur a Levine,2007,"The seventh and final book of the blockbuster Harry Potter series follows the wizard's last year at Hogwarts School of Witchcraft and Wizardry. 12,000,000 first printing.",UOM:39076002651854,9780545010221,759.0,BOOK,['Juvenile Fiction'],4.5,3449.0,http://books.google.com/books/content?id=JHEkAQAAMAAJ&printsec=frontcover&img=1&zoom=5&source=gbs_api,en,http://books.google.ca/books?id=JHEkAQAAMAAJ&dq=isbn:9780545010221&hl=&cd=1&source=gbs_api,CA,NOT_FOR_SALE,False,"The seventh and final book of the blockbuster Harry Potter series follows the wizard&#39;s last year at Hogwarts School of Witchcraft and Wizardry. 12,000,000 first printing."
122,['J. K. Rowling'],Fantastic Beasts and Where to Find Them,,Bloomsbury Publishing,2009,"An entertaining companion to the Harry Potter books, written by J.K. Rowling. Fantastic Beasts and Where to Find Them is an extensive introduction to magical beasts familiar from the Harry Potter books and others we haven't yet met. Includes information about beasts which can be found in Australia and New Zealand and what they eat.",9781408803011,9781408803011,88.0,BOOK,"['Animals, Mythical']",4.5,24.0,http://books.google.com/books/content?id=EcekAwAAQBAJ&printsec=frontcover&img=1&zoom=5&source=gbs_api,en,http://books.google.ca/books?id=EcekAwAAQBAJ&dq=isbn:9781408803011&hl=&cd=1&source=gbs_api,CA,NOT_FOR_SALE,False,"An entertaining companion to the Harry Potter books, written by J.K. Rowling. Fantastic Beasts and Where to Find Them is an extensive introduction to magical beasts familiar from the Harry Potter books and others we haven&#39;t yet met."
123,,,,,,,,9780545128285,,,,,,,,,,,,
124,"['J. K. Rowling', 'John Tiffany', 'Jack Thorne']",Harry Potter and the Cursed Child - Parts One and Two,The Official Script Book of the Original West End Production Special Rehearsal Edition,Arthur A. Levine Books,2016-07-31,"The Eighth Story. Nineteen Years Later. Based on an original new story by J.K. Rowling, John Tiffany, and Jack Thorne, a new play by Jack Thorne, ""Harry Potter and the Cursed Child"" is the eighth story in the Harry Potter series and the first official Harry Potter story to be presented on stage. The play will receive its world premiere in London's West End on July 30, 2016. It was always difficult being Harry Potter and it isn't much easier now that he is an overworked employee of the Ministry of Magic, a husband and father of three school-age children. While Harry grapples with a past that refuses to stay where it belongs, his youngest son Albus must struggle with the weight of a family legacy he never wanted. As past and present fuse ominously, both father and son learn the uncomfortable truth: sometimes, darkness comes from unexpected places. This Special Rehearsal Edition will be available to purchase until early 2017, after which a Definitive Edition of the script will go on sale.",1338099132,9781338099133,336.0,BOOK,,4.5,6.0,http://books.google.com/books/content?id=Jx1ojwEACAAJ&printsec=frontcover&img=1&zoom=5&source=gbs_api,en,http://books.google.ca/books?id=Jx1ojwEACAAJ&dq=isbn:9781338099133&hl=&cd=1&source=gbs_api,CA,NOT_FOR_SALE,False,"As an overworked employee of the Ministry of Magic, a husband, and a father, Harry Potter struggles with a past that refuses to stay where it belongs while his youngest son, Albus, finds the weight of the family legacy difficult to bear."
125,['Neil Gaiman'],Trigger Warning,Short Fictions and Disturbances,William Morrow,2020-12-29,"From one of the most critically acclaimed and beloved storytellers of our time comes a major new collection of stories, now available in a pulp-inspired mass market edition with cover art by renowned artist Robert McGinnis! In this wide-ranging collection of short fiction, Neil Gaiman pierces the veil of reality to reveal the enigmatic, shadowy world that lies beneath. This rich compendium features stories and poetry that transport us deep into the realm of imagination--where the fantastical becomes real and the everyday incandescent--including an original American Gods novella in which Shadow Moon finds himself drawn into the dark and murderous mystery of the ""Black Dog"" in the English Peak District. Horror and ghost stories, speculative fiction and fairy tales, fabulism and verse--all combine to illustrate the strength and breadth of Gaiman's storytelling mastery and cement his reputation as one of the finest writers at work today.",0063052040,9780063052048,400.0,BOOK,['Fiction'],3.5,3326.0,http://books.google.com/books/content?id=GSF3zQEACAAJ&printsec=frontcover&img=1&zoom=5&source=gbs_api,en,http://books.google.ca/books?id=GSF3zQEACAAJ&dq=isbn:9780063052048&hl=&cd=1&source=gbs_api,CA,NOT_FOR_SALE,False,"Trigger Warning includes previously published pieces of short fiction--stories, verse, and a very special Doctor Who story that was written for the fiftieth anniversary of the beloved series in 2013--as well as &#39;Black Dog,&#39; a new tale that ..."
126,['Neil Gaiman'],Fragile Things,Short Fictions and Wonders,Harper Collins,2010-02-09,"A mysterious circus terrifies an audience for one extraordinary performance before disappearing into the night . . . Two teenage boys crash a party and meet the girls of their dreams—and nightmares . . . In a Hugo Award–winning story, a great detective must solve a most unsettling royal murder in a strangely altered Victorian England . . . These marvelous creations and more showcase the unparalleled invention and storytelling brilliance—and the terrifyingly dark and entertaining wit—of the incomparable Neil Gaiman. By turns delightful, disturbing, and diverting, Fragile Things is a gift of literary enchantment from one of the most original writers of our time.",9780060515232,9780060515232,400.0,BOOK,['Fiction'],4.0,115.0,http://books.google.com/books/content?id=NoFHsQiguDIC&printsec=frontcover&img=1&zoom=5&source=gbs_api,en,http://books.google.ca/books?id=NoFHsQiguDIC&dq=isbn:9780060515232&hl=&cd=1&source=gbs_api,CA,NOT_FOR_SALE,False,"By turns delightful, disturbing, and diverting, Fragile Things is a gift of literary enchantment from one of the most original writers of our time."
127,"['Terry Pratchett', 'Neil Gaiman']",Good Omens,"The Nice and Accurate Prophecies of Agnes Nutter, Witch",Random House,1991,"According to the Nice and Accurate Prophecies of Agnes Nutter--the world's only totally reliable guide to the future--the world will end on a Saturday. Next Saturday, in fact. Just after tea...",9780552137034,9780552137034,382.0,BOOK,['Fiction'],4.0,3016.0,http://books.google.com/books/content?id=LVNKTs5Oz4MC&printsec=frontcover&img=1&zoom=5&source=gbs_api,en,http://books.google.ca/books?id=LVNKTs5Oz4MC&dq=isbn:9780552137034&hl=&cd=1&source=gbs_api,CA,NOT_FOR_SALE,False,"According to the Nice and Accurate Prophecies of Agnes Nutter--the world&#39;s only totally reliable guide to the future--the world will end on a Saturday. Next Saturday, in fact. Just after tea..."
128,['Neil Gaiman'],Stardust,,William Morrow,2016-09-27,"Now a major motion picture—this charming fairy tale by the #1 New York Times bestselling author, weaves a magical story set long ago in the tiny English village of Wall, a place where things are not quite what they seem. Go and catch a falling star . . . Tristran Thorn promises to bring back a fallen star for his beloved, the hauntingly beautiful Victoria Forester—and crosses the wall that divides his English country town from another, more dangerous world of lords and witches, all of them in search of the star. Rich with adventure and magic, Stardust is one of master storyteller Neil Gaiman's most beloved tales. “Eminently readable—a charming piece of work.” —Washington Post Book World “Beautiful, memorable . . . A book full of marvels.” —Milwaukee Journal Sentinel",006256434X,9780062564344,288.0,BOOK,['Fiction'],,,http://books.google.com/books/content?id=4tFsjwEACAAJ&printsec=frontcover&img=1&zoom=5&source=gbs_api,en,http://books.google.ca/books?id=4tFsjwEACAAJ&dq=isbn:9780062564344&hl=&cd=1&source=gbs_api,CA,NOT_FOR_SALE,False,"Rich with adventure and magic, Stardust is one of master storyteller Neil Gaiman&#39;s most beloved tales."
129,['Neil Gaiman'],American Gods: The Tenth Anniversary Edition,A Novel,William Morrow,2016-08-16,"Newly updated and expanded with the author’s preferred text. A modern masterpiece from the multiple-award-winning master of innovative fiction, Neil Gaiman. First published in 2001, American Gods became an instant classic, lauded for its brilliant synthesis of “mystery, satire, sex, horror, and poetic prose” (Washington Post) and as a modern phantasmagoria that “distills the essence of America” (Seattle Post-Intelligencer). It is the story of Shadow—released from prison just days after his wife and best friend are killed in an accident—who gets recruited to be bodyguard, driver, and errand boy for the enigmatic trickster, Mr. Wednesday. So begins Shadow’s dark and strange road trip, one that introduces him to a host of eccentric characters whose fates are mysteriously intertwined with his own. For, beneath the placid surface of everyday life, a storm is brewing—an epic war for the very soul of America—and Shadow is standing squarely in its path. “Pointed, occasionally comic, often scary, consistently moving and provocative….American Gods is strewn with secrets and magical visions.”—USA Today “Original, engrossing, and endlessly inventive.”—George R. R. Martin",0062472100,9780062472106,784.0,BOOK,['Fiction'],,,http://books.google.com/books/content?id=T8EVjwEACAAJ&printsec=frontcover&img=1&zoom=5&source=gbs_api,en,http://books.google.ca/books?id=T8EVjwEACAAJ&dq=isbn:9780062472106&hl=&cd=1&source=gbs_api,CA,NOT_FOR_SALE,False,"It is the story of Shadow—released from prison just days after his wife and best friend are killed in an accident—who gets recruited to be bodyguard, driver, and errand boy for the enigmatic trickster, Mr. Wednesday."
130,['Neil Gaiman'],The Ocean at the End of the Lane,A Novel,William Morrow Paperbacks,2014-06-03,"A middle-aged man returns to his childhood home to attend a funeral. Although the house he lived in is long gone, he is drawn to the farm at the end of the road, where, when he was seven, he encountered a most remarkable girl, Lettie Hempstock, and her mother and grandmother. He hasn't thought of Lettie in decades, and yet as he sits by the pond (a pond that she'd claimed was an ocean) behind the ramshackle old farmhouse where she once lived, the unremembered past comes flooding back. And it is a past too strange, too frightening, too dangerous to have happened to anyone, let alone a small boy. A groundbreaking work as delicate as a butterfly's wing and as menacing as a knife in the dark, The Ocean at the End of the Lane is told with a rare understanding of all that makes us human, and shows the power of stories to reveal and shelter us from the darkness inside and out.",0062255665,9780062255662,208.0,BOOK,['Fiction'],4.0,3302.0,http://books.google.com/books/content?id=BhmKngEACAAJ&printsec=frontcover&img=1&zoom=5&source=gbs_api,en,http://books.google.ca/books?id=BhmKngEACAAJ&dq=isbn:9780062255662&hl=&cd=1&source=gbs_api,CA,NOT_FOR_SALE,False,"A groundbreaking work as delicate as a butterfly&#39;s wing and as menacing as a knife in the dark, The Ocean at the End of the Lane is told with a rare understanding of all that makes us human, and shows the power of stories to reveal and ..."
131,['Neil Gaiman'],Smoke and Mirrors,Short Fictions and Illusions,Harper Collins,2008-01-29,"In the deft hands of Neil Gaiman, magic is no mere illusion . . . and anything is possible. In Smoke and Mirrors, Gaiman's imagination and supreme artistry transform a mundane world into a place of terrible wonders—where an old woman can purchase the Holy Grail at a thrift store, where assassins advertise their services in the Yellow Pages under ""Pest Control,"" and where a frightened young boy must barter for his life with a mean-spirited troll living beneath a bridge by the railroad tracks. Explore a new reality, obscured by smoke and darkness yet brilliantly tangible, in this extraordinary collection of short works by a master prestidigitator. It will dazzle your senses, touch your heart, and haunt your dreams.",9780061450167,9780061450167,368.0,BOOK,['Fiction'],4.0,60.0,http://books.google.com/books/content?id=kwDsO09EHIwC&printsec=frontcover&img=1&zoom=5&source=gbs_api,en,http://books.google.ca/books?id=kwDsO09EHIwC&dq=isbn:9780061450167&hl=&cd=1&source=gbs_api,CA,NOT_FOR_SALE,False,"Explore a new reality, obscured by smoke and darkness yet brilliantly tangible, in this extraordinary collection of short works by a master prestidigitator. It will dazzle your senses, touch your heart, and haunt your dreams."
132,['Neil Gaiman'],Coraline,,Harper Collins,2006-08-29,In Coraline's family's new flat there's a locked door. On the other side is a brick wall—until Coraline unlocks the door . . . and finds a passage to another flat in another house just like her own. Only different. The food is better there. Books have pictures that writhe and crawl and shimmer. And there's another mother and father there who want Coraline to be their little girl. They want to change her and keep her with them. . . . Forever. Coraline is an extraordinary fairy tale/nightmare from the uniquely skewed imagination of #1 New York Times bestselling author Neil Gaiman.,9780061139376,9780061139376,192.0,BOOK,['Fiction'],4.0,305.0,http://books.google.com/books/content?id=pXlAY0XnrQUC&printsec=frontcover&img=1&zoom=5&source=gbs_api,en,http://books.google.ca/books?id=pXlAY0XnrQUC&dq=isbn:9780061139376&hl=&cd=1&source=gbs_api,CA,NOT_FOR_SALE,False,In Coraline&#39;s family&#39;s new flat there&#39;s a locked door. On the other side is a brick wall—until Coraline unlocks the door . . . and finds a passage to another flat in another house just like her own. Only different.
133,['Neil Gaiman'],Neil Gaiman [box Set],,,2015,"HORROR & GHOST STORIES, CHILLERS. This exclusive box set contains the British editions of three bestselling Neil Gaiman classics in paperback, including the Newbery Medal and Carnegie Medal winner The Graveyard Book; Coraline; and Fortunately, the Milk, all illustrated by acclaimed artist Chris Riddell.The editions of Coraline, The Graveyard Book, and Fortunately, the Milk in this box set contain the illustrations from the British editions, which are both hilarious and moving. Acclaimed artist Chris Riddell has won the Kate Greenaway Medal twice, among other awards and honors.These paperbacks have never before been published in the United States and are available here only in this special box set. Ages 9+",0062380648,9780062380647,,BOOK,['Ghost stories'],,,,en,http://books.google.ca/books?id=yYznjgEACAAJ&dq=isbn:9780062380647&hl=&cd=1&source=gbs_api,CA,NOT_FOR_SALE,False,"While picking up milk for his children&#39;s cereal, a father is abducted by aliens and finds himself on a wild adventure through time and space."
134,['Neil Gaiman'],The View from the Cheap Seats,Selected Nonfiction,William Morrow Paperbacks,2017-05-16,"An enthralling collection of nonfiction essays on a myriad of topics—from art and artists to dreams, myths, and memories—observed in #1 New York Times bestselling author Neil Gaiman’s probing, amusing, and distinctive style. An inquisitive observer, thoughtful commentator, and assiduous craftsman, Neil Gaiman has long been celebrated for the sharp intellect and startling imagination that informs his bestselling fiction. Now, The View from the Cheap Seats brings together for the first time ever more than sixty pieces of his outstanding nonfiction. Analytical yet playful, erudite yet accessible, this cornucopia explores a broad range of interests and topics, including (but not limited to): authors past and present; music; storytelling; comics; bookshops; travel; fairy tales; America; inspiration; libraries; ghosts; and the title piece, at turns touching and self-deprecating, which recounts the author’s experiences at the 2010 Academy Awards in Hollywood. Insightful, incisive, witty, and wise, The View from the Cheap Seats explores the issues and subjects that matter most to Neil Gaiman—offering a glimpse into the head and heart of one of the most acclaimed, beloved, and influential artists of our time.",0062262270,9780062262271,256.0,BOOK,['Literary Collections'],4.0,184.0,http://books.google.com/books/content?id=2sg_vgAACAAJ&printsec=frontcover&img=1&zoom=5&source=gbs_api,en,http://books.google.ca/books?id=2sg_vgAACAAJ&dq=isbn:9780062262271&hl=&cd=1&source=gbs_api,CA,NOT_FOR_SALE,False,"Analytical yet playful, erudite yet accessible, these essays explore a broad range of interests and topics, including (but not limited to): authors past and present; music; storytelling; comics; bookshops; travel; fairy tales; America; ..."
135,['Neil Gaiman'],Neverwhere Illustrated Edition,,William Morrow,2017-09-26,"National Bestseller Selected as one of NPR’S Top 100 Science Fiction and Fantasy Books of All Time The #1 New York Times bestselling author’s dark classic of modern fantasy, beautifully illustrated for the first time by award-winning artist Chris Riddell, and featuring the author’s preferred text and his Neverwhere tale, “How the Marquis Got His Coat Back.” Published in 1997, Neil Gaiman’s first novel, Neverwhere, heralded the arrival of a major talent. Over the years, various versions have been produced around the world. In 2016, this gorgeously illustrated edition of the novel was released in the UK. It is now available here, and features strikingly atmospheric, painstakingly detailed black-and-white line art by Chris Riddell, one of Gaiman’s favorite artistic interpreters of his work. Richard Mayhew is a young London businessman with a good heart whose life is changed forever when he stops to help a bleeding girl—an act of kindness that plunges him into a world he never dreamed existed. Slipping through the cracks of reality, Richard lands in Neverwhere—a London of shadows and darkness, monsters and saints, murderers and angels that exists entirely in a subterranean labyrinth. Neverwhere is home to Door, the mysterious girl Richard helped in the London Above. Here in Neverwhere, Door is a powerful noblewoman who has vowed to find the evil agent of her family’s slaughter and thwart the destruction of this strange underworld kingdom. If Richard is ever to return to his former life and home, he must join Lady Door’s quest to save her world—and may well die trying.",0062821334,9780062821331,448.0,BOOK,['Fiction'],,,http://books.google.com/books/content?id=5jrEswEACAAJ&printsec=frontcover&img=1&zoom=5&source=gbs_api,en,http://books.google.ca/books?id=5jrEswEACAAJ&dq=isbn:9780062821331&hl=&cd=1&source=gbs_api,CA,NOT_FOR_SALE,False,"In 2016, this gorgeously illustrated edition of the novel was released in the UK. It is now available here, and features strikingly atmospheric, painstakingly detailed black-and-white line art by Chris Riddell, one of Gaiman’s favorite ..."
136,['Neil Gaiman'],Norse Mythology,,,2017-02-07,"Introducing an instant classic master storyteller Neil Gaiman presents a dazzling version of the great Norse myths.""",039360909X,9780393609097,304.0,BOOK,['Fiction'],4.0,109.0,http://books.google.com/books/content?id=4rXJDAEACAAJ&printsec=frontcover&img=1&zoom=5&source=gbs_api,en,http://books.google.ca/books?id=4rXJDAEACAAJ&dq=isbn:9780393609097&hl=&cd=1&source=gbs_api,CA,NOT_FOR_SALE,False,Introducing an instant classic--master storyteller Neil Gaiman presents a dazzling version of the great Norse myths.
137,['Neil Gaiman'],The Graveyard Book,,Harper Collins,2008-09-30,"Nobody Owens, known to his friends as Bod, is a normal boy. He would be completely normal if he didn't live in a sprawling graveyard, being raised and educated by ghosts, with a solitary guardian who belongs to neither the world of the living nor of the dead. There are dangers and adventures in the graveyard for a boy-an ancient Indigo Man beneath the hill, a gateway to a desert leading to an abandoned city of ghouls, the strange and terrible menace of the Sleer. But if Bod leaves the graveyard, then he will come under attack from the man Jack—who has already killed Bod's family. . . . Beloved master storyteller Neil Gaiman returns with a luminous new novel for the audience that embraced his New York Times bestselling modern classic Coraline. Magical, terrifying, and filled with breathtaking adventures, the graveyard book is sure to enthrall readers of all ages.",9780060530921,9780060530921,320.0,BOOK,['Juvenile Fiction'],4.0,692.0,http://books.google.com/books/content?id=kSpQvfX1BSoC&printsec=frontcover&img=1&zoom=5&source=gbs_api,en,http://books.google.ca/books?id=kSpQvfX1BSoC&dq=isbn:9780060530921&hl=&cd=1&source=gbs_api,CA,NOT_FOR_SALE,False,"Magical, terrifying, and filled with breathtaking adventures, the graveyard book is sure to enthrall readers of all ages."
138,['Neil Gaiman'],The Ocean at the End of the Lane (Illustrated Edition),,William Morrow,2019-11-05,"It began for our narrator forty years ago when the family lodger stole their car and committed suicide in it, stirring up ancient powers best left undisturbed. Dark creatures from beyond the world are on the loose, and it will take everything our narrator has just to stay alive: there is primal horror here, and menace unleashed-- within his family and from the forces that have gathered to destroy it. His only defense is three women on a farm at the end of the lane. The youngest of them claims that her duckpond is an ocean. The oldest can remember the Big Bang.",0062995316,9780062995315,336.0,BOOK,['Fiction'],,,http://books.google.com/books/content?id=eOdgyAEACAAJ&printsec=frontcover&img=1&zoom=5&source=gbs_api,en,http://books.google.ca/books?id=eOdgyAEACAAJ&dq=isbn:9780062995315&hl=&cd=1&source=gbs_api,CA,NOT_FOR_SALE,False,"It began for our narrator forty years ago when the family lodger stole their car and committed suicide in it, stirring up ancient powers best left undisturbed."
139,['Neil Gaiman'],The Neil Gaiman Reader,Selected Fiction,William Morrow,2020-10-06,"An outstanding array--52 pieces in all--of selected fiction from the multiple-award-winning, #1 New York Times bestselling author Neil Gaiman, curated by his readers around the world, and introduced with a foreword by Booker Prize-winning author Marlon James Spanning Gaiman's career to date, The Neil Gaiman Reader: Selected Fiction is a captivating collection from one of the world's most beloved writers, chosen by those who know his work best: his devoted readers. A brilliant representation of Gaiman's groundbreaking, entrancing, endlessly imaginative fiction, this captivating volume includes excerpts from each of his five novels for adults --Neverwhere, Stardust, American Gods, Anansi Boys, and The Ocean at the End of the Lane--and nearly fifty of his short stories. Impressive in its depth and range, The Neil Gaiman Reader: Selected Fiction is both an entryway to Gaiman's oeuvre and a literary trove Gaiman fans old and new will return to many times over.",006303185X,9780063031852,752.0,BOOK,['Fiction'],4.0,1.0,http://books.google.com/books/content?id=2D0wzQEACAAJ&printsec=frontcover&img=1&zoom=5&source=gbs_api,en,http://books.google.ca/books?id=2D0wzQEACAAJ&dq=isbn:9780063031852&hl=&cd=1&source=gbs_api,CA,NOT_FOR_SALE,False,"A ... representation of Gaiman&#39;s ... imaginative fiction, this ... volume includes excerpts from each of his five novels for adults--Neverwhere, Stardust, American Gods, Anansi Boys, and The Ocean at the End of the Lane--and nearly fifty of ..."
140,,,,,,,,761941208466,,,,,,,,,,,,
